{
  "version": "1.0",
  "agentId": "treasury-agent-01",
  "principal": "0x1111111111111111111111111111111111111111",
  "agentAccount": "0x2222222222222222222222222222222222222222",
  "scope": {
    "canPropose": true,
    "canVote": true,
    "proposalTypes": ["TREASURY_PAYMENT", "PARAM_TUNE_NONRESERVED", "TEXT_SIGNAL"],
    "allowedTargets": [
      "0x3333333333333333333333333333333333333333",
      "0x4444444444444444444444444444444444444444"
    ],
    "forbiddenSelectors": [],
    "spendingCap": {
      "token": "0x036CbD53842c5426634e7929541eC2318f3dCF7e",
      "perTx": "1000000000",
      "perEpoch": "10000000000",
      "epochSeconds": 604800
    }
  },
  "votingPolicy": "ipfs://bafyTREASURYpolicyPLACEHOLDER",
  "humanRatification": { "valueUsdGte": 5000, "impact": ["HIGH"] },
  "requireSimulation": true,
  "rationaleStorage": "ipfs",
  "guardian": "0x5555555555555555555555555555555555555555",
  "createdAt": "2026-01-01T00:00:00Z",
  "expiresAt": "2026-12-31T23:59:59Z"
}
