{
  "version": "1.0",
  "agentId": "GOV-01",
  "principal": "0x3C44CdDdB6a900fa2b585dd299e03d12FA4293BC",
  "agentAccount": "0x9965507D1a55bcC2695C58ba16FB37d819B0A4dc",
  "scope": {
    "canPropose": true,
    "canVote": true,
    "proposalTypes": ["TEXT_SIGNAL", "PARAM_TUNE_NONRESERVED"],
    "allowedTargets": [],
    "forbiddenSelectors": [
      "0x2f2ff15d",
      "0xd547741f",
      "0x36568abe",
      "0x64d62353",
      "0xd8804832",
      "0x6a3722c5",
      "0xacb5cb8e",
      "0xb51e77d5",
      "0x23d91713",
      "0xe5961754",
      "0x3659cfe6",
      "0x4f1ef286"
    ],
    "spendingCap": null
  },
  "votingPolicy": "ipfs://bafyGOV01votingPolicyPLACEHOLDER",
  "humanRatification": { "valueUsdGte": 0, "impact": ["HIGH"] },
  "requireSimulation": true,
  "rationaleStorage": "ipfs",
  "guardian": "0x70997970C51812dc3A010C7d01b50e0d17dc79C8",
  "createdAt": "2026-06-24T00:00:00Z",
  "expiresAt": "2026-09-24T00:00:00Z"
}
